{
  "$schema": "https://json-schema.org/draft/2020-12/schema",
  "$id": "https://agent-framework-java.dev/harness/run-score.schema.json",
  "title": "RunScore",
  "type": "object",
  "additionalProperties": false,
  "required": ["schemaVersion", "suite", "configuration", "passed", "metrics", "violations"],
  "properties": {
    "schemaVersion": { "const": "1.0" },
    "suite": { "type": "string", "minLength": 1 },
    "configuration": {
      "type": "object",
      "additionalProperties": false,
      "required": ["instructionHash", "harnessVersion", "toolchain", "upstreamRevision"],
      "properties": {
        "instructionHash": { "type": "string", "minLength": 1 },
        "harnessVersion": { "type": "string", "minLength": 1 },
        "toolchain": { "type": "string", "minLength": 1 },
        "upstreamRevision": { "type": "string", "minLength": 1 }
      }
    },
    "passed": { "type": "boolean" },
    "metrics": {
      "type": "object",
      "additionalProperties": false,
      "required": ["durationMs", "toolCalls", "scopeViolations"],
      "properties": {
        "durationMs": { "type": "integer", "minimum": 0 },
        "toolCalls": { "type": "integer", "minimum": 0 },
        "scopeViolations": { "type": "integer", "minimum": 0 }
      }
    },
    "violations": { "type": "array", "items": { "type": "string" } }
  }
}
